{"id": "aicg2025-1", "name": "Ori", "flavorText": "A small feline predator that scratches everything with his claws, but can purr to calm friends.", "types": ["Darkness"], "supertype": "Pok\u00e9mon", "subtypes": ["Basic"], "level": "28", "hp": "70", "evolvesFrom": "", "abilities": [{"name": "Purring Calm", "text": "Once per turn, when this Pok\u00e9mon is hit by an attack, you may prevent all effects of that attack, including damage.", "type": "Ability"}], "attacks": [{"name": "Clawed Swipe", "cost": ["Colorless", "Colorless", "Darkness"], "convertedEnergyCost": 3, "damage": "60", "text": "Flip a coin. If heads, the Defending Pok\u00e9mon is now Paralyzed."}], "weaknesses": [{"type": "Fighting", "value": "\u00d72"}], "retreatCost": ["Colorless", "Colorless", "Darkness"], "convertedRetreatCost": 3, "number": "1", "artist": "Alexandra Dabrowska", "rarity": "Common", "nationalPokedexNumbers": [123], "images": {"small": "https://images.pokemontcg.io/aicg2025/1.png", "large": "https://images.pokemontcg.io/aicg2025/1_hires.png"}}