{"id": "neo2-8", "name": "Politoed", "flavorText": "Whenever three or more of these get together, they sing in a loud voice that sounds like bellowing.", "types": ["Water"], "supertype": "Pok\u00e9mon", "subtypes": ["Stage 2"], "level": "53", "hp": "100", "evolvesFrom": "Poliwhirl", "abilities": [{"name": "Frog Song", "text": "Whenever Politoed's attack damages the Defending Pok\u00e9mon (after applying Weakness and Resistance), if there are more than 3 Poliwags, Poliwhirls, Poliwraths, and/or Politoeds in play (including your opponent's), that attack does 40 more damage (no matter how many heads you get). This power stops working while Politoed is Asleep, Confused, or Paralyzed.", "type": "Pok\u00e9mon Power"}], "attacks": [{"name": "Doubleslap", "cost": ["Water", "Water", "Colorless", "Colorless"], "convertedEnergyCost": 4, "damage": "40\u00d7", "text": "Flip 2 coins. This attack does 40 damage times the number of heads."}], "weaknesses": [{"type": "Grass", "value": "\u00d72"}], "retreatCost": ["Colorless", "Colorless", "Colorless"], "convertedRetreatCost": 3, "number": "8", "artist": "Tomokazu Komiya", "rarity": "Rare Holo", "nationalPokedexNumbers": [186], "images": {"small": "https://images.pokemontcg.io/neo2/8.png", "large": "https://images.pokemontcg.io/neo2/8_hires.png"}}