{"id": "dp2-19", "name": "Abomasnow", "flavorText": "It whips up blizzards in mountains that are always buried in snow. It is the abominable snowman.", "types": ["Grass"], "supertype": "Pok\u00e9mon", "subtypes": ["Stage 1"], "level": "40", "hp": "100", "evolvesFrom": "Snover", "abilities": [{"name": "Glacier Snow", "text": "If Abomasnow is your Active Pok\u00e9mon and is damaged by an opponent's attack (even if Abomasnow is Knocked Out), the Attacking Pok\u00e9mon is now Asleep.", "type": "Pok\u00e9-Body"}], "attacks": [{"name": "Heavy Blizzard", "cost": ["Water", "Colorless", "Colorless"], "convertedEnergyCost": 3, "damage": "60", "text": "Flip a coin. If heads, put 1 damage counter on each of your opponent's Benched Pok\u00e9mon."}], "weaknesses": [{"type": "Fire", "value": "+30"}], "retreatCost": ["Colorless", "Colorless", "Colorless"], "convertedRetreatCost": 3, "number": "19", "artist": "Kazuyuki Kano", "rarity": "Rare", "nationalPokedexNumbers": [460], "images": {"small": "https://images.pokemontcg.io/dp2/19.png", "large": "https://images.pokemontcg.io/dp2/19_hires.png"}}