{"id": "base3-43", "name": "Slowbro", "flavorText": "The Shellder that is latched onto Slowpoke's tail is said to feed on the host's left-over scraps.", "types": ["Psychic"], "supertype": "Pok\u00e9mon", "subtypes": ["Stage 1"], "level": "26", "hp": "60", "evolvesFrom": "Slowpoke", "abilities": [{"name": "Strange Behavior", "text": "As often as you like during your turn (before your attack), you may move 1 damage counter from 1 of your Pok\u00e9mon to Slowbro as long as you don't Knock Out Slowbro. This power can't be used if Slowbro is Asleep, Confused, or Paralyzed.", "type": "Pok\u00e9mon Power"}], "attacks": [{"name": "Psyshock", "cost": ["Psychic", "Psychic"], "convertedEnergyCost": 2, "damage": "20", "text": "Flip a coin. If heads, the Defending Pok\u00e9mon is now Paralyzed."}], "weaknesses": [{"type": "Psychic", "value": "\u00d72"}], "retreatCost": ["Colorless"], "convertedRetreatCost": 1, "number": "43", "artist": "Kagemaru Himeno", "rarity": "Uncommon", "nationalPokedexNumbers": [80], "images": {"small": "https://images.pokemontcg.io/base3/43.png", "large": "https://images.pokemontcg.io/base3/43_hires.png"}}