{"id": "base1-21", "name": "Electrode", "flavorText": "It stores electrical energy under very high pressure. It often explodes with little or no provocation.", "types": ["Lightning"], "supertype": "Pok\u00e9mon", "subtypes": ["Stage 1"], "level": "40", "hp": "80", "evolvesFrom": "Voltorb", "abilities": [{"name": "Buzzap", "text": "At any time during your turn (before your attack), you may Knock Out Electrode and attach it to 1 of your other Pok\u00e9mon. If you do, choose a type of Energy. Electrode is now an Energy card (instead of a Pok\u00e9mon) that provides 2 energy of that type. You can't use this power if Electrode is Asleep, Confused, or Paralyzed.", "type": "Pok\u00e9mon Power"}], "attacks": [{"name": "Electric Shock", "cost": ["Lightning", "Lightning", "Lightning"], "convertedEnergyCost": 3, "damage": "50", "text": "Flip a coin. If tails, Electrode does 10 damage to itself."}], "weaknesses": [{"type": "Fighting", "value": "\u00d72"}], "retreatCost": ["Colorless"], "convertedRetreatCost": 1, "number": "21", "artist": "Keiji Kinebuchi", "rarity": "Rare", "nationalPokedexNumbers": [101], "images": {"small": "https://images.pokemontcg.io/base1/21.png", "large": "https://images.pokemontcg.io/base1/21_hires.png"}}